{
  "@context": "https://ulcs.dev/context/v1",
  "@type": "ContextEnvelope",
  "schemaVersion": "1.0.0",
  "id": "urn:ulcs:context:fixture-extension-type",
  "createdAt": "2026-08-15T12:00:00Z",
  "facts": [
    {
      "id": "urn:ulcs:fact:1",
      "@type": "Fact",
      "content": "A regular fact for comparison.",
      "extensions": {
        "x-acme:relatedTicket": "TICKET-42",
        "x-acme:score": 0.87
      }
    }
  ]
}
